{
  "policyVersion": "2.0",
  "planId": "racy-support-agent",
  "maximumObservationAgeMs": 300000,
  "maximumCheckUseGapMs": 180000,
  "maximumCommitStateAgeMs": 30000,
  "maximumRevalidationAgeMs": 60000,
  "minimumAuthority": 80,
  "requireConditionalForMutations": true,
  "requireRevalidationForIrreversible": true,
  "requireScopeBinding": true,
  "maximumDependencyDepth": 3,
  "maximumActions": 100,
  "maximumObservations": 100,
  "maximumDependencyEdges": 300
}
